{
  "schema_version": 1,
  "policy_id": "trusted-change-005",
  "task_id": "reject branch substitution",
  "repository": "acme/widget",
  "head_ref": "refs/heads/feat/trusted-change",
  "base_sha": "1111111111111111111111111111111111111111",
  "allowed_paths": ["src/**"],
  "off_limits": [],
  "verification": [
    {"name": "unit", "command": "bash tests/run_all.sh"}
  ]
}
