{
  "schema_version": 1,
  "policy_id": "trusted-change-001",
  "task_id": "trusted change authorization prototype",
  "repository": "acme/widget",
  "head_ref": "refs/heads/feat/trusted-change",
  "base_sha": "1111111111111111111111111111111111111111",
  "allowed_paths": ["src/**", "tests/**"],
  "off_limits": [".github/**"],
  "verification": [
    {"name": "unit", "command": "bash tests/run_all.sh", "timeout_seconds": 900}
  ]
}
