{
  "schema_version": 1,
  "policy_id": "trusted-change-002",
  "task_id": "do not widen scope from task branch",
  "repository": "acme/widget",
  "head_ref": "refs/heads/feat/trusted-change",
  "base_sha": "1111111111111111111111111111111111111111",
  "allowed_paths": ["src/**", "docs/**"],
  "off_limits": [],
  "verification": [
    {"name": "skip", "command": "true"}
  ]
}
